<!ELEMENT tienda (producto+)>
<!ELEMENT producto (nombre, pvp, discripcion, stock, iva)>
<!ATTLIST producto
          id CDATA #REQUIRED>
<!ELEMENT nombre (#PCDATA)>
<!ELEMENT pvp (#PCDATA)>
<!ELEMENT discripcion (#PCDATA)>
<!ELEMENT stock (#PCDATA)>
<!ELEMENT iva (#PCDATA)>
